{
  "clip_id": "MG-D3-0001",
  "original_filename": "empty-road-01.mp4",
  "asset_path": "/assets/mangystau/day3/empty-road-01.mp4",
  "project": {
    "series": "Mangystau Documentary",
    "episode": "Day 3 — Layers of Color and The Fangs",
    "destination": "Zhanaozen to Bozzhyra route",
    "country": "Kazakhstan",
    "region": "Mangystau"
  },
  "location": {
    "name": "Desert road beyond Zhanaozen",
    "sub_location": "Last road leaving civilization"
  },
  "camera": {
    "type": "drone",
    "shot_type": "drone-forward-push",
    "movement": "slow-push",
    "altitude": "medium-high",
    "lens_feel": "wide",
    "stability": "excellent"
  },
  "visual_context": {
    "time_of_day": "unknown",
    "weather": "clear preferred",
    "light_quality": "soft preferred",
    "landscape_type": "desert road",
    "human_presence": false,
    "vehicle_presence": true
  },
  "emotion_tags": ["isolation", "anticipation", "humility"],
  "story_tags": ["threshold", "journey", "departure"],
  "best_usage": ["leaving civilization", "threshold beat", "opening movement", "transition into wilderness"],
  "scores": {
    "composition": 90,
    "light": 82,
    "movement": 88,
    "stability": 90,
    "emotion": 94,
    "story_relevance": 98,
    "overall": 92
  },
  "flags": {
    "hero_shot": false,
    "avoid": false,
    "needs_review": true
  },
  "director_notes": "Use this clip when narration mentions leaving the final city, entering emptiness, or crossing into wilderness. Hold longer than a normal transition shot to let the silence and scale breathe."
}
